Book_ID,Authors,Publication_Year,Title,title,language_code,average_rating,Ratings_Count,Total_Ratings,Text_Reviews,One_Star_Ratings,Two_Star_Ratings,Three_Star_Ratings,Four_Star_Ratings,Five_Star_Ratings
6235,Jenny Nimmo,2004.0,"Charlie Bone and the Invisible Boy (The Children of the Red King, # 3)","Charlie Bone and the Invisible Boy (The Children of the Red King, #3)",eng,3.89,19080,19833,372,281,1137,5345,6732,6338
6239,Ellen Schreiber,2009.0,"Royal Blood (Vampire Kisses, #6)","Royal Blood (Vampire Kisses, #6)",eng,4.09,20049,20485,346,411,1225,4169,4931,9749
6244,Jessica Day George,2006.0,"Dragon Slippers (Dragon Slippers, #1)","Dragon Slippers (Dragon Slippers, #1)",en-US,4.22,20916,22475,2040,268,592,3415,7794,10406
6248,Lisa McMann,2010.0,Gone ,"Gone (Wake, #3)",eng,3.72,24393,26058,1903,659,2657,7375,7894,7473
6263,S.A. Bodeen,2008.0,The Compound,"The Compound (The Compound, #1)",en-US,3.87,17687,18515,2341,437,1304,4443,6448,5883
6266,Kimberly Derting,2011.0,The Pledge,"The Pledge (The Pledge, #1)",eng,3.8,25322,26646,2419,681,2140,6696,9374,7755
6270,Dan Wells,2013.0,Fragments,"Fragments (Partials Sequence, #2)",eng,4.12,19108,20491,1720,209,622,3590,8173,7897
6275,Charlie Higson,2009.0,The Enemy,"The Enemy (The Enemy, #1)",eng,4.08,12531,17921,2029,380,858,3124,6146,7413
6279,Kenneth Oppel,2004.0,Airborn,"Airborn (Matt Cruse, #1)",eng,4.16,18717,20114,1694,311,600,3266,7246,8691
6282,"Colin Meloy, Carson Ellis",2011.0,Wildwood,"Wildwood (Wildwood Chronicles, #1)",eng,3.63,18770,20205,2798,835,2005,5678,6933,4754
6296,Sherwood Smith,1997.0,Crown Duel ,Crown Duel (Crown & Court #1-2),,4.19,19546,20200,913,336,827,3327,5927,9783
6301,Ilsa J. Bick,2011.0,Monsters,"Ashes (Ashes Trilogy, #1)",eng,3.94,19532,21937,2778,616,1295,4601,7735,7690
6308,"Michelle Paver, Geoff Taylor",2004.0,Wolf Brother,"Wolf Brother (Chronicles of Ancient Darkness, #1)",en-US,4.15,15673,18078,1255,247,684,3136,6070,7941
6332,Heather Brewer,2009.0,Tenth Grade Bleeds,"Tenth Grade Bleeds (The Chronicles of Vladimir Tod, #3)",en-US,4.24,17579,18510,725,201,607,3045,5261,9396
6350,"Dave Barry, Ridley Pearson, Greg Call",2007.0,Peter and the Secret of Rundoon,"Peter and the Secret of Rundoon (Peter and the Starcatchers, #3)",en-US,4.16,18570,19299,858,246,522,3476,6702,8353
6368,Tamora Pierce,1998.0,Daja's Book,"Daja's Book (Circle of Magic, #3)",eng,4.06,22695,23993,324,128,882,5377,8568,9038
6374,Tamora Pierce,1999.0,Briar's Book,"Briar's Book (Circle of Magic, #4)",eng,4.14,23152,24366,358,140,784,4797,8442,10203
6387,L.J. Smith,1997.0,The Forbidden Game,"The Forbidden Game (The Forbidden Game, #1-3)",en-US,4.19,18443,19505,966,344,968,3232,5132,9829
6388,Elizabeth Scott,2008.0,Perfect You,Perfect You,en-US,3.7,20858,20946,899,703,2022,6104,6172,5945
6391,Cecily von Ziegesar,2004.0,You're the one that I want,"You're the One That I Want (Gossip Girl, #6)",eng,3.71,16643,17023,209,473,1616,5342,4516,5076
6396,Alison Croggon,2002.0,The Gift,"The Naming (The Books of Pellinor, #1)",en-US,4.0,19214,21162,1366,483,1207,4133,7432,7907
6402,Cecily von Ziegesar,2002.0,You Know You Love Me,"You Know You Love Me (Gossip Girl, #2)",en-US,3.53,18052,19075,690,600,2333,6711,5205,4226
6421,Lauren Kate,2013.0,Teardrop,"Teardrop (Teardrop, #1)",eng,3.65,18998,21248,2318,1120,2291,5560,6187,6090
6429,Carolyn Keene,2008.0,"Nancy Drew Complete Series Set, Books 1-64",Nancy Drew: #1-64,eng,4.19,16743,16810,360,273,541,2897,5116,7983
6433,Brigid Kemmerer,2012.0,Storm,"Storm (Elemental, #1)",en-US,3.96,21281,22950,2281,529,1220,4722,8619,7860
6434,Maureen Johnson,2011.0,The Last Little Blue Envelope,"The Last Little Blue Envelope (Little Blue Envelope, #2)",en-US,3.86,19275,20354,1499,329,1224,5321,7518,5962
6448,Garth Nix,2004.0,Grim Tuesday,"Grim Tuesday (The Keys to the Kingdom, #2)",,3.86,19133,20613,446,218,1024,5757,8003,5611
6466,Leila Sales,2013.0,This Song Will Save Your Life,This Song Will Save Your Life,eng,3.95,19947,21486,3166,642,1250,4432,7397,7765
6470,"Jenny Han, Siobhan Vivian",2012.0,Burn for Burn,"Burn for Burn (Burn for Burn, #1)",eng,3.87,18772,20309,2722,423,1203,4987,7748,5948
6478,Tahereh Mafi,2013.0,Fracture Me,"Fracture Me (Shatter Me, #2.5)",eng,3.77,24092,25350,2872,497,2239,7512,7384,7718
6490,Orson Scott Card,2010.0,Pathfinder,"Pathfinder (Pathfinder, #1)",en-US,3.98,16979,18845,2130,305,872,3724,7948,5996
6495,"Jim Kjelgaard, Carl Pfeuffer",1945.0,Big Red,"Big Red (Big Red, #1)",,4.11,15923,16068,199,239,532,3219,5306,6772
6503,Jaclyn Moriarty,2003.0,Finding Cassie Crazy,"The Year of Secret Assignments (Ashbury/Brookfield, #2)",eng,3.9,16357,17921,837,317,1264,4301,6010,6029
6505,L.M. Montgomery,1926.0,The Blue Castle,The Blue Castle ,en-US,4.23,18190,20815,2672,260,672,3209,6627,10047
6515,Kasie West,2013.0,Pivot Point,"Pivot Point (Pivot Point, #1)",eng,4.08,20173,21502,3277,471,872,3549,8131,8479
6522,Becca Fitzpatrick,2014.0,Unknown,Black Ice,,3.88,17571,21354,3190,857,1658,4429,6691,7719
6531,L.J. Smith,2008.0,Unknown,"The Initiation / The Captive Part I (The Secret Circle, #1-2)",eng,3.96,19563,21026,1024,440,1402,4746,6465,7973
6541,"Joseph Delaney, Patrick  Arrasmith",2007.0,Attack of the Fiend (The Last Apprentice #4),"Attack of the Fiend (The Last Apprentice / Wardstone Chronicles, #4)",eng,4.19,14814,17183,537,139,437,2920,6199,7488
6550,Caragh M. O'Brien,2011.0,Prized,"Prized (Birthmarked, #2)",en-US,3.99,19328,20795,1717,305,1011,4401,7958,7120
6563,Ellen Schreiber,2005.0,"Kissing Coffins (Vampire Kisses, #2)","Kissing Coffins (Vampire Kisses, #2)",en-US,3.87,22124,22921,719,680,2041,5718,5613,8869
6565,John Corey Whaley,2011.0,Where Things Come Back,Where Things Come Back,eng,3.81,14852,17534,2805,468,1372,4278,6267,5149
6571,John Flanagan,2011.0,The Outcasts,"The Outcasts (Brotherband Chronicles, #1)",eng,4.37,16613,18183,1071,197,317,1901,5935,9833
6582,L.A. Meyer,2002.0,"Bloody Jack: Being an Account of the Curious Adventures of Mary ""Jacky"" Faber, Ship's Boy","Bloody Jack (Bloody Jack, #1)",eng,4.11,19147,20265,2001,475,834,3403,6873,8680
6608,Kathryn Lasky,2003.0,The Capture,"The Capture (Guardians of Ga'Hoole, #1)",eng,3.88,18830,20258,1296,511,1355,4938,6622,6832
6616,Neal Shusterman,2013.0,UnSouled,"UnSouled (Unwind, #3)",en-US,4.23,15526,19175,2037,87,382,2866,7625,8215
6623,Megan Abbott,2012.0,Dare Me,Dare Me,eng,3.23,15618,17353,2684,1154,3070,5956,4930,2243
6624,Rachel Caine,2011.0,Last Breath,"Last Breath (The Morganville Vampires, #11)",eng,4.32,19963,21799,1224,190,482,3024,6600,11503
6628,E.D. Baker,2002.0,"The Frog Princess (The Tales of the Frog Princess, #1)","The Frog Princess (Tales of the Frog Princess, #1)",eng,3.81,22176,22774,1131,585,1759,6186,7108,7136
6635,Ellen Schreiber,2010.0,"Love Bites (Vampire Kisses, #7)","Love Bites (Vampire Kisses, #7)",en-US,4.13,17707,17970,316,327,1048,3489,4248,8858
6640,Garth Nix,2007.0,Lady Friday,"Lady Friday (The Keys to the Kingdom, #5)",en-US,3.91,17675,18565,275,163,900,5018,6784,5700
6643,Wendy Mass,2008.0,Every Soul A Star,Every Soul a Star,eng,4.1,17282,18138,1653,256,777,3362,6237,7506
6649,Kendare Blake,2012.0,Girl of Nightmares,"Girl of Nightmares (Anna, #2)",eng,3.9,20708,22645,3111,363,1383,5512,8354,7033
6652,Darren Shan,2005.0,"Lord of the Shadows (Cirque Du Freak, #11)","Lord of the Shadows (Cirque Du Freak, #11)",eng,4.22,15794,17290,352,159,605,2807,5397,8322
6658,L.J. Smith,1991.0,The Fury,"The Fury (The Vampire Diaries, #3)",en-US,3.55,19911,23800,730,1001,3026,7453,6435,5885
6660,Harlan Coben,2011.0,Shelter,"Shelter (Mickey Bolitar, #1)",eng,3.92,9081,17190,1992,227,808,4130,6911,5114
6666,Josephine Angelini,2013.0,Goddess,"Goddess (Starcrossed, #3)",eng,4.24,20589,23486,1841,286,829,3412,7286,11673
6671,Robison Wells,2011.0,Variant,"Variant (Variant, #1)",en-US,3.92,18473,19423,2509,338,1158,4482,7102,6343
6674,Amy Efaw,2009.0,After,After,eng,3.73,17238,17777,1810,732,1678,4494,5549,5324
6679,Julianna Baggott,2012.0,Pure,"Pure (Pure, #1)",en-US,3.74,18778,21222,3024,787,1694,5346,7715,5680
6680,Susane Colasanti,2010.0,Something Like Fate,Something Like Fate,,3.72,17347,18139,1276,686,1873,4916,5050,5614
6683,Diane Duane,1983.0,So You Want to Be a Wizard,"So You Want to Be a Wizard (Young Wizards, #1)",en-US,3.8,20408,22281,971,798,1791,5478,7247,6967
6705,Jennifer L. Armentrout,2014.0,Don't Look Back,Don't Look Back,eng,4.11,11499,21777,3300,303,806,3789,8159,8720
6710,Wendelin Van Draanen,2011.0,Unknown,The Running Dream,eng,4.3,17061,18023,2833,187,472,2234,5990,9140
6721,Anna Godbersen,2009.0,Envy,"Envy (Luxe, #3)",en-US,3.91,20432,21991,1224,252,1296,5503,8143,6797
6722,Ann Aguirre,2013.0,Horde,"Horde (Razorland, #3)",en-CA,4.28,17422,18993,1822,196,520,2548,6277,9452
6733,Scott Westerfeld,2005.0,Peeps,"Peeps (Peeps, #1)",eng,3.77,20702,22514,1937,570,1747,6076,7940,6181
6734,Alison Croggon,2004.0,Unknown,"The Riddle (The Books of Pellinor, #2)",en-US,4.1,16605,18120,520,239,769,3386,6344,7382
6747,Carrie Ryan,2011.0,The Dark And Hollow Places,"The Dark and Hollow Places (The Forest of Hands and Teeth, #3)",eng,4.03,19282,20422,1927,407,1069,4029,6876,8041
6754,Terry Pratchett,2012.0,Dodger,Dodger,eng,3.9,14775,18798,2482,213,990,4442,7902,5251
6755,Gary Paulsen,1991.0,The River,"The River (Brian's Saga, #2)",,3.77,14198,16545,891,233,1225,5077,5558,4452
6756,Juliet Marillier,2007.0,Wildwood Dancing,"Wildwood Dancing (Wildwood, #1)",en-US,4.09,21810,22892,2125,357,1016,4249,7961,9309
6765,Jean Ferris,2002.0,Once Upon a Marigold,"Once Upon a Marigold (Upon a Marigold, #1)",eng,3.98,20394,20860,1430,288,1089,4921,7089,7473
6771,Chanda Hahn,2012.0,Unknown,"Fairest (An Unfortunate Fairy Tale, #2)",en-US,4.12,16315,16463,956,114,557,3190,5951,6651
6775,"Brian K. Vaughan, Adrian Alphona",2006.0,Unknown,"Runaways, Vol. 1: Pride and Joy (Runaways, #1)",eng,4.02,18111,18776,676,474,869,3629,6662,7142
6780,Garth Nix,2006.0,Sir Thursday,"Sir Thursday (The Keys to the Kingdom, #4)",en-US,3.94,17624,18494,310,163,808,4674,7171,5678
6792,D.J. MacHale,2008.0,Raven Rise,"Raven Rise (Pendragon, #9)",en-US,4.2,17691,18086,351,253,689,2814,5706,8624
6794,Robert Muchamore,2004.0,Class A (Cherub #2),"Class A (Cherub, #2)",en-US,4.26,14299,15638,630,92,374,2254,5496,7422
6800,Darren Shan,2005.0,Lord Loss,"Lord Loss (The Demonata, #1)",eng,4.21,15325,16835,1172,238,641,2568,5219,8169
6801,Meg Cabot,2010.0,Runaway ,"Runaway (Airhead, #3)",eng,3.93,20846,21662,839,385,1424,5257,6928,7668
6805,Joelle Charbonneau,2014.0,Graduation Day,"Graduation Day (The Testing, #3)",eng,3.81,14963,17926,1585,280,1361,4762,6540,4983
6813,Cynthia Kadohata,2004.0,Unknown,Kira-Kira,eng,3.9,18166,18947,2279,344,1171,4568,6812,6052
6815,Pittacus Lore,2015.0,Unknown,"The Fate of Ten (Lorien Legacies, #6)",eng,4.32,16819,18917,1917,91,335,2426,6684,9381
6839,Michael Thomas Ford,2008.0,Suicide Notes,Suicide Notes,eng,3.92,14749,15399,1096,435,1069,3395,4878,5622
6848,Mike Mullin,2011.0,Ashfall,"Ashfall (Ashfall, #1)",eng,3.96,18583,19771,2612,526,1041,4006,7319,6879
6859,Robert Muchamore,2005.0,Maximum Security (Cherub #3),"Maximum Security (Cherub, #3)",eng,4.24,14860,15719,426,76,408,2436,5552,7247
6861,Maria V. Snyder,2010.0,Inside Out,"Inside Out (Insider, #1)",eng,3.82,20472,22001,1882,598,1467,5568,8111,6257
6881,Elizabeth Eulberg,2014.0,Better Off Friends,Better off Friends,eng,3.95,15692,19201,2613,403,1126,4219,6786,6667
6901,Jeanne DuPrau,2008.0,The Diamond of Darkhold,"The Diamond of Darkhold (Book of Ember, #4)",eng,3.79,18425,20330,1586,262,1387,5966,7475,5240
6906,Jennifer Estep,2011.0,Touch of Frost,"Touch of Frost (Mythos Academy, #1)",en-US,3.96,23343,25742,1905,560,1434,5436,9395,8917
6911,Laurie Faria Stolarz,2008.0,"Deadly Little Secret (Touch, #1)","Deadly Little Secret (Touch, #1)",eng,3.86,20156,21162,1622,566,1702,5151,6373,7370
6915,John Marsden,1994.0,The Dead of the Night,"The Dead of Night (Tomorrow, #2)",eng,4.13,15240,17279,607,69,399,3095,7410,6306
6918,Sherrilyn Kenyon,2011.0,Invincible (Chronicles of Nick #2),"Invincible (Chronicles of Nick, #2)",en-US,4.27,19887,21653,1096,158,559,3136,7280,10520
6925,A.S. King,2012.0,Ask the Passengers,Ask the Passengers,en-US,3.88,17896,18978,2325,532,1180,4270,6966,6030
6938,Margaret Peterson Haddix,1995.0,Running Out of Time,Running Out of Time,eng,3.98,19126,20326,1291,224,1002,4639,7603,6858
6947,Leslye Walton,2014.0,The Strange and Beautiful Sorrows of Ava Lavender,The Strange and Beautiful Sorrows of Ava Lavender,eng,4.12,18562,21560,4798,388,1066,3384,7410,9312
6952,Gemma Malley,2007.0,The Declaration,"The Declaration (The Declaration, #1)",,3.71,16224,19274,1555,544,1631,5419,6926,4754
6956,Obert Skye,2005.0,"Leven Thumps and the Gateway to Foo (Leven Thumps, #1)","Leven Thumps and the Gateway to Foo (Leven Thumps, #1)",,3.71,17760,18044,1539,709,1729,4896,5469,5241
6972,Avi,2002.0,Crispin: The Cross of Lead,"The Cross of Lead (Crispin, #1)",eng,3.59,18277,19115,1738,866,1836,5728,6524,4161
6985,Catherine Fisher,2000.0,Sapphique,"Sapphique (Incarceron, #2)",eng,3.7,16475,19648,1786,475,1717,5784,6838,4834
6986,Lurlene McDaniel,1995.0,"Don't Die, My Love","Don't Die, My Love",,4.12,14197,14383,574,304,681,2795,3784,6819
6989,Sandy   Hall,2014.0,A Little Something Different,A Little Something Different,eng,3.65,14206,16719,3118,733,1571,4722,5545,4148
7013,Lauren Oliver,2011.0,Hana,"Hana (Delirium, #1.5)",eng,3.63,20107,21357,1886,286,1918,7603,7063,4487
7018,David Colbert,2001.0,"The Magical Worlds of Harry Potter: A Treasury of Myths, Legends, and Fascinating Facts","The Magical Worlds of Harry Potter: A Treasury of Myths, Legends, and Fascinating Facts",eng,3.96,13820,15145,267,329,1125,3766,3593,6332
7020,Shannon Hale,2009.0,Forest Born,"Forest Born (The Books of Bayern, #4)",en-US,4.01,20603,21243,2049,156,917,4782,8053,7335
7023,Kate Brian,2006.0,Private,"Private (Private, #1)",eng,3.81,16556,17054,978,765,1530,3890,4932,5937
7050,Derek Landy,2008.0,Playing with Fire,"Playing with Fire (Skulduggery Pleasant, #2)",en-US,4.31,15533,18533,1013,73,338,2536,6358,9228
7054,Darren Shan,2002.0,"Sons of Destiny (Cirque Du Freak, Book 12)","Sons of Destiny (Cirque Du Freak, #12)",,4.22,14997,16453,741,345,694,2518,4359,8537
7057,Emmy Laybourne,2012.0,Monument 14,"Monument 14 (Monument 14, #1)",eng,3.89,17360,18739,2649,463,1196,4256,6796,6028
7091,Richard Paul Evans,2012.0,Rise of the Elgen,"Rise of the Elgen (Michael Vey, #2)",eng,4.29,15152,16060,1473,112,378,2190,5428,7952
7144,"James Patterson, Chris Tebbetts, Laura Park",2011.0,Unknown,"Middle School: The Worst Years of My Life (Midde School, #1)",eng,4.01,14178,15319,1838,456,1010,2995,4301,6557
7148,Alwyn Hamilton,2016.0,Rebel of the Sands,"Rebel of the Sands (Rebel of the Sands, #1)",eng,3.96,16789,23329,4449,358,1143,4732,10038,7058
7157,Colleen Houck,2012.0,Tiger's Destiny,"Tiger's Destiny (The Tiger Saga, #4)",eng,4.41,18503,19385,2057,287,589,1994,4526,11989
7171,Cornelia Funke,1990.0,Inkheart,"The Inkheart Trilogy: Inkheart, Inkspell, Inkdeath (Inkworld, #1-3)",eng,4.17,14014,15215,452,279,631,2516,4572,7217
7181,Lynda Mullaly Hunt,2012.0,Unknown,One for the Murphys,eng,4.31,16058,17018,2088,202,472,2102,5260,8982
7183,Megan Shepherd,2013.0,The Madman’s Daughter,"The Madman’s Daughter (The Madman’s Daughter, #1)",eng,3.69,17647,19008,3298,713,1899,4898,6545,4953
7190,Huntley Fitzpatrick,2014.0,What I Thought Was True,What I Thought Was True,eng,3.71,16390,17545,1753,553,1547,5053,5707,4685
7192,Sara Shepard,2011.0,Ruthless,"Ruthless (Pretty Little Liars, #10)",en-US,3.93,16885,17869,906,338,1159,4400,5498,6474
7195,Jenny Nimmo,2007.0,"Charlie Bone and the Beast (The Children of the Red King, # 6)","Charlie Bone and the Beast (The Children of the Red King, #6)",en-US,3.93,16397,16803,264,271,970,4251,5490,5821
7201,Lauren Conrad,2010.0,Sugar and Spice,"Sweet Little Lies (L.A. Candy, #2)",en-US,3.53,14901,15946,756,417,1874,5804,4558,3293
7218,John Flanagan,2011.0,The Lost Stories,"The Lost Stories (Ranger's Apprentice, #11)",eng,4.27,15816,18664,842,123,564,2785,5818,9374
7220,Hannah Harrington,2011.0,Saving June,Saving June,eng,3.97,14867,16238,1489,425,954,3358,5384,6117
7222,Anna Banks,2013.0,Unknown,"Of Triton (The Syrena Legacy, #2)",eng,4.0,19216,20368,1834,239,1075,4336,7430,7288
7229,Jack Gantos,2011.0,Unknown,Dead End in Norvelt,eng,3.72,15877,16432,2996,570,1393,4440,5752,4277
7246,Jerry Spinelli,2002.0,Loser,Loser,eng,3.72,15079,15678,1613,427,1384,4446,5259,4162
7266,Roald Dahl,1977.0,The Wonderful Story Of Henry Sugar And Six More,The Wonderful Story of Henry Sugar and Six More,eng,4.15,13419,16370,840,97,510,3073,5928,6762
7284,Sara Zarr,2008.0,Sweethearts,Sweethearts,en-US,3.64,16515,17151,1688,608,1860,5098,5186,4399
7288,Julie Kagawa,2012.0,The Lost Prince,"The Lost Prince (The Iron Fey: Call of the Forgotten, #1)",eng,4.05,21049,22483,2319,340,972,4564,8031,8576
7295,Meg Cabot,2005.0,Ready or Not,"Ready or Not (All-American Girl, #2)",eng,3.4,21089,22530,793,1067,3297,7810,6277,4079
7304,Margaret Peterson Haddix,2003.0,Among the Barons,"Among the Barons (Shadow Children, #4)",en-US,4.08,17495,18050,631,94,589,3901,6685,6781
7308,Meg Cabot,2007.0,Jinx,Jinx,en-US,3.72,21745,23372,1332,435,2065,7164,7724,5984
7317,Michael Morpurgo,2003.0,Private Peaceful,Private Peaceful,eng,4.16,13123,15168,1099,178,506,2534,5390,6560
7334,Cath Crowley,2010.0,Graffiti Moon,Graffiti Moon,eng,3.9,14176,16494,1840,748,1099,3351,5176,6120
7342,Kimberly Derting,2011.0,Desires of the Dead,"Desires of the Dead (The Body Finder, #2)",en-US,4.07,20654,21374,1588,261,915,4272,7528,8398
7355,Cristin Terrill,2013.0,All Our Yesterdays,All Our Yesterdays,eng,4.05,16338,18234,3013,414,889,3375,6293,7263
7362,Nina LaCour,2014.0,Everything Leads to You,Everything Leads to You,eng,3.89,17583,18734,2191,580,1193,4257,6366,6338
7363,Wendy Mass,2006.0,Jeremy Fink and the Meaning of Life,Jeremy Fink and the Meaning of Life,en-US,4.02,15567,16317,1522,315,883,3252,5635,6232
7374,Derek Landy,2008.0,The Faceless Ones,"The Faceless Ones (Skulduggery Pleasant, #3)",eng,4.4,14971,16785,712,53,230,1881,5366,9255
7387,Cate Tiernan,2001.0,Book of Shadows,"Book of Shadows (Sweep, #1)",eng,4.04,18691,20597,1132,467,1155,4119,6230,8626
7400,Siobhan Vivian,2012.0,The List,The List,eng,3.46,16569,18700,2601,748,2540,6328,5472,3612
7410,V.C. Andrews,1986.0,Dark Angel,"Dark Angel (Casteel, #2)",eng,3.96,14720,15364,179,151,912,3867,4911,5523
7421,Emily M. Danforth,2012.0,The Miseducation of Cameron Post,The Miseducation of Cameron Post,en-US,3.99,16235,17385,2101,493,903,3200,6542,6247
7423,Diana Wynne Jones,2008.0,House of Many Ways,"House of Many Ways (Howl's Moving Castle, #3)",en-US,4.03,17697,20317,1477,98,715,4376,8350,6778
7430,Louisa May Alcott,1876.0,Rose in Bloom,"Rose in Bloom (Eight Cousins, #2)",en-US,4.03,16842,18265,430,329,838,3875,6112,7111
7431,David  Arnold,2015.0,Mosquitoland,Mosquitoland,eng,3.92,14312,17108,2882,390,1107,3710,6207,5694
7433,Melina Marchetta,1992.0,Looking for Alibrandi,Looking for Alibrandi,eng,3.85,14685,17432,1244,308,991,4419,6951,4763
7437,Kody Keplinger,2012.0,A Midsummer's Nightmare,A Midsummer's Nightmare,eng,3.83,17247,18056,1325,531,1243,4596,6130,5556
7451,Sarah Mlynowski,2011.0,Ten Things We Did (and Probably Shouldn't Have) ,Ten Things We Did (and Probably Shouldn't Have),en-US,3.74,15396,17430,1697,461,1478,4936,5757,4798
7452,Moira Young,2012.0,Rebel Heart,"Rebel Heart (Dust Lands, #2)",eng,3.89,16265,17545,1965,484,1140,3929,6268,5724
7475,Heather Brewer,2010.0,The Chronicles of Vladimir Tod: Eleventh Grade Burns,"Eleventh Grade Burns (The Chronicles of Vladimir Tod, #4)",,4.31,14758,15366,609,156,432,2188,4287,8303
7479,"Brian Jacques, Allan Curless",1997.0,The Long Patrol,"The Long Patrol (Redwall, #10)",,4.1,15343,15948,199,62,489,3459,5748,6190
7502,Jessica Day George,2008.0,"Dragon Flight (Dragon Slippers, #2)","Dragon Flight (Dragon Slippers, #2)",en-US,4.18,15918,16460,846,205,499,2840,5512,7404
7505,Tamora Pierce,2003.0,Shatterglass,"Shatterglass (The Circle Opens, #4)",eng,4.16,18253,19233,242,104,596,3731,6493,8309
7514,Margaret Peterson Haddix,2004.0,"Among the Brave (Shadow Children, #5)","Among the Brave (Shadow Children, #5)",en-US,4.14,16527,16985,565,90,472,3307,6133,6983
7535,Danielle  Paige,2015.0,The Wicked Will Rise,"The Wicked Will Rise (Dorothy Must Die, #2)",eng,3.82,16739,18487,2285,255,1094,5155,7240,4743
7546,Cecily von Ziegesar,2003.0,All I Want Is Everything,"All I Want is Everything (Gossip Girl, #3)",eng,3.56,15467,16076,422,433,1879,5728,4270,3766
7553,Jonathan Maberry,2011.0,Dust & Decay,"Dust & Decay (Rot & Ruin, #2)",eng,4.29,13646,14559,1362,159,345,1846,4991,7218
7555,Laura Ruby,2015.0,Bone Gap,Bone Gap,eng,3.86,15150,16756,3451,315,1133,3937,6550,4821
7558,Meg Cabot,2004.0,Teen Idol,Teen Idol,en-US,3.53,20271,21934,871,529,2631,7845,6621,4308
7560,Stephanie Garber,2017.0,Caraval,Caraval,eng,3.97,30975,35821,8360,831,2531,7001,12105,13353
7565,Cheryl Rainfield,2010.0,Scars,Scars,en-US,4.17,12452,12976,1018,318,683,2056,3285,6634
7598,Tamora Pierce,2011.0,Mastiff,"Mastiff (Beka Cooper, #3)",en-US,4.24,19695,20774,1403,240,703,3057,6547,10227
7613,Brandon Mull,2013.0,"Chasing the Prophecy (Beyonders, #3)","Chasing the Prophecy (Beyonders, #3)",eng,4.35,11816,13529,1039,160,289,1521,4259,7300
7626,Lisi Harrison,2004.0,"Best Friends for Never (The Clique, #2)","Best Friends for Never (The Clique, #2)",,3.73,15345,15578,849,519,1604,4324,4228,4903
7632,Alexandra Bracken,2016.0,Passenger,"Passenger (Passenger, #1)",eng,3.84,23070,24910,5065,765,1786,5420,9610,7329
7646,Gloria Levine,2008.0,Unknown,Ralph S. Mouse by Beverly Cleary: Teacher Guide (Novel Units),,3.95,14513,14513,49,355,659,3626,4548,5325
7653,Jodi Lynn Anderson,2012.0,Tiger Lily,Tiger Lily,eng,3.98,16217,19116,4012,483,1234,3791,6258,7350
7655,Philip Pullman,1985.0,The Ruby in the Smoke,"The Ruby in the Smoke (Sally Lockhart, #1)",en-US,3.75,16214,19279,1129,276,1204,5713,7926,4160
7657,A.C. Gaughen,2012.0,Scarlet,"Scarlet (Scarlet, #1)",eng,3.95,19665,20503,2574,669,1196,4074,7024,7540
7658,Miranda Kenneally,2012.0,Stealing Parker,Stealing Parker,en-US,3.88,15997,16789,1216,358,1110,4177,5628,5516
7663,Alexander Gordon Smith,2009.0,Lockdown,"Lockdown (Escape from Furnace, #1)",en-US,4.1,14024,15565,1995,346,734,2651,5128,6706
7672,Veronica Roth,2014.0,Unknown,"The Traitor (Divergent, #0.4)",eng,4.19,12299,15371,568,136,538,2745,4878,7074
7680,"Aya Nakahara, Pookie Rolf",2001.0,ラブ★コン 1,"Love★Com, Vol. 1",eng,4.22,13801,13994,215,398,624,2107,3267,7598
7685,Kristin Levine,2012.0,The Lions of Little Rock,The Lions of Little Rock,eng,4.22,12962,13692,1632,304,447,1744,4655,6542
7687,Amanda Hocking,2010.0,Unknown,"Hollowland (The Hollows, #1)",eng,3.97,13847,17073,1569,416,1057,3458,5910,6232
7697,L.J. Smith,2009.0,The Secret Circle: The Captive Part II and The Power,"The Captive Part II / The Power (The Secret Circle, #2-3)",eng,4.11,16231,17148,553,218,815,3446,5116,7553
7712,Maki Minami,2003.0,スペシャル·エー,"Special A, Vol. 1 (Special A, #1)",ind,4.18,14607,15289,159,396,755,2499,3621,8018
7714,Elizabeth George Speare,1961.0,The Bronze Bow,The Bronze Bow,en-US,3.93,15507,16325,1465,487,977,3406,5729,5726
7725,Kiersten White,2012.0,Endlessly,"Endlessly (Paranormalcy, #3)",eng,3.99,18789,19490,1528,292,1177,4388,6202,7431
7745,Ally Carter,2013.0,Perfect Scoundrels,"Perfect Scoundrels (Heist Society, #3)",en-GB,4.28,20029,20912,1711,145,406,2889,7463,10009
7757,Cammie McGovern,2014.0,Amy & Matthew,Say What You Will,eng,3.7,11559,13778,1905,408,1202,3951,4796,3421
7759,Meg Cabot,2006.0,Party Princess,"Party Princess (The Princess Diaries, #7)",,3.67,19068,21002,498,393,1893,7070,6487,5159
7773,Kendare Blake,2016.0,Three Dark Crowns,"Three Dark Crowns (Three Dark Crowns, #1)",eng,3.86,9386,21650,4782,467,1491,5006,8385,6301
7776,Aprilynne Pike,2012.0,Destined,"Destined (Wings, #4)",en-US,4.19,18485,19571,1631,282,776,3200,5966,9347
7785,V.C. Andrews,1990.0,Dawn ,"Dawn (Cutler, #1)",eng,3.87,13674,14091,255,205,1086,3872,4162,4766
7792,Adam Gidwitz,2010.0,A Tale Dark and Grimm,"A Tale Dark & Grimm (A Tale Dark & Grimm, #1)",en-US,4.04,15041,17643,2875,344,926,3488,5866,7019
7797,L.J. Smith,1991.0,Dark Reunion,"Dark Reunion (The Vampire Diaries, #4)",eng,3.54,17056,20148,669,1005,2635,6133,5194,5181
7802,Gayle Forman,2014.0,Just One Night,"Just One Night (Just One Day, #2.5)",eng,4.12,15986,17406,2018,231,805,3117,5774,7479
7804,"James Patterson, Jill Dembowski, Elijah Wood, Spencer Locke",2011.0,Unknown,"The Fire (Witch & Wizard, #3)",,3.87,11789,15877,840,426,1215,3838,4923,5475
7805,John Marsden,1995.0,"The Third Day, The Frost","A Killing Frost (Tomorrow, #3)",,4.19,13199,15090,503,37,317,2500,6152,6084
7833,Gene Stratton-Porter,1909.0,A Girl of the Limberlost,"A Girl of the Limberlost (Limberlost, #2)",eng,4.14,13071,15705,1242,230,628,2788,5194,6865
7840,S.E. Hinton,1975.0,Rumble Fish,Rumble Fish,,3.77,14002,14999,746,174,978,4692,5370,3785
7880,Meg Cabot,2007.0,Princess Mia,"Princess Mia (The Princess Diaries, #9)",en-US,3.82,17889,19575,616,330,1383,5591,6451,5820
7895,Tamora Pierce,2001.0,Street Magic,"Street Magic (The Circle Opens, #2)",eng,4.12,18897,19900,272,103,685,4078,6907,8127
7897,Jodi Meadows,2012.0,Incarnate,"Incarnate (Newsoul, #1)",en-US,3.73,19034,20030,2530,901,1819,4930,6521,5859
7915,Tamara Ireland Stone,2015.0,Every Last Word,Every Last Word,eng,4.2,19214,20437,3021,419,756,2985,6362,9915
7919,Eoin Colfer,2007.0,Airman,Airman,eng,4.14,15257,16323,1347,197,619,2855,5757,6895
7926,Jessica Verday,2009.0,The Hollow,"The Hollow (The Hollow, #1)",eng,3.75,16734,18415,1542,1085,1846,4147,4856,6481
7934,Robin McKinley,2000.0,Spindle's End,Spindle's End,eng,3.79,18395,19652,1204,339,1336,5560,7276,5141
7943,Joan Bauer,2000.0,Hope Was Here,Hope Was Here,eng,4.0,14954,15670,1340,217,738,3408,5832,5475
