Book_ID,Authors,Publication_Year,Title,title,language_code,average_rating,Ratings_Count,Total_Ratings,Text_Reviews,One_Star_Ratings,Two_Star_Ratings,Three_Star_Ratings,Four_Star_Ratings,Five_Star_Ratings
4667,Anthony Horowitz,2011.0,Scorpia Rising,Scorpia Rising (Alex Rider #9),eng,4.29,23268,24512,984,265,669,3360,7501,12717
4669,Meg Cabot,2008.0,Forever Princess,"Forever Princess (The Princess Diaries, #10)",,4.08,28127,29733,1018,436,1474,6210,8697,12916
4675,Anthony Horowitz,2009.0,Crocodile Tears,"Crocodile Tears (Alex Rider, #8)",eng,4.18,23068,24561,759,204,804,4240,8379,10934
4698,L.M. Montgomery,1921.0,Rilla of Ingleside,"Rilla of Ingleside (Anne of Green Gables, #8)",eng,4.16,29277,31379,1160,305,1311,5696,9945,14122
4705,Ann Aguirre,2012.0,Outpost,"Outpost (Razorland, #2)",en-US,4.12,25650,27482,2003,335,958,4840,10417,10932
4710,Gail Carriger,2013.0,Etiquette & Espionage,"Etiquette & Espionage (Finishing School, #1)",en-CA,3.79,29821,34613,5256,1096,2352,8632,13038,9495
4712,Tamora Pierce,1997.0,Sandry's Book,"Sandry's Book (Circle of Magic, #1)",en-US,3.99,30169,31992,809,376,1573,7466,11106,11471
4720,Suzanne Collins,2006.0,Gregor and the Marks of Secret,"Gregor and the Marks of Secret (Underland Chronicles, #4)",eng,4.21,23727,25671,1041,178,557,4117,9617,11202
4745,Brandon Sanderson,2013.0,Mitosis,"Mitosis (The Reckoners, #1.5)",eng,3.87,17250,22181,1477,69,714,6245,10075,5078
4750,Linda Sue Park,2010.0,A Long Walk to Water,A Long Walk to Water: Based on a True Story,eng,4.23,21593,24076,3832,277,661,3284,8965,10889
4751,Michael  Grant,2013.0,Light,"Light (Gone, #6)",eng,4.4,23730,26356,2459,303,618,2811,7216,15408
4761,C.C. Hunter,2012.0,Whispers at Moonrise ,"Whispers at Moonrise (Shadow Falls, #4)",eng,4.38,28430,29922,1339,212,657,3437,8916,16700
4770,David Levithan,2013.0,Two Boys Kissing,Two Boys Kissing,eng,4.11,24587,27058,3187,1030,1238,4237,7808,12745
4775,Tamora Pierce,2009.0,"Bloodhound (Beka Cooper, #2)","Bloodhound (Beka Cooper, #2)",eng,4.26,29414,30570,993,216,826,4450,10390,14688
4782,Angie Sage,2009.0,Syren,"Syren (Septimus Heap, #5)",eng,4.1,25245,26679,746,295,1064,5244,9193,10883
4800,Clive Barker,1992.0,The Thief of Always,The Thief of Always,eng,4.18,19799,22200,1275,138,613,3904,7989,9556
4815,Judy Blume,1974.0,Blubber,Blubber,en-GB,3.78,25402,27462,961,486,1685,8274,9879,7138
4819,Meg Cabot,2008.0,Airhead ,"Airhead (Airhead, #1)",eng,3.77,32457,34101,2002,875,2861,9350,11142,9873
4821,Beth Fantaskey,2000.0,Jessica's Guide to Dating on the Dark Side,"Jessica's Guide to Dating on the Dark Side (Jessica, #1)",en-US,3.85,32763,35481,2799,1142,2833,8503,10877,12126
4830,Richelle Mead,2015.0,The Ruby Circle,"The Ruby Circle (Bloodlines, #6)",eng,4.22,29260,32890,4043,287,1123,5153,10792,15535
4907,Mike Lupica,2006.0,Heat,Heat,en-US,3.97,16579,16831,1229,382,875,3657,5951,5966
4911,"Rick Riordan, Tk",2009.0,Percy Jackson and the Olympians,"Percy Jackson and the Olympians Boxed Set (Percy Jackson and the Olympians, #1-5)",,4.57,19555,22766,850,173,279,1678,4957,15679
4916,Darren Shan,2001.0,"Trials of Death (Cirque du Freak, #5) ","Trials of Death (Cirque Du Freak, #5)",,4.25,22157,24259,620,126,725,3793,7871,11744
4925,Terry Pratchett,2008.0,Nation,Nation,en-US,4.05,22466,26588,2441,365,1225,5215,9721,10062
4934,Kathryn Erskine,2010.0,Mockingbird,Mockingbird,eng,4.18,21138,23766,3626,249,703,3854,8755,10205
4937,Zilpha Keatley Snyder,1967.0,The Egypt Game,"The Egypt Game (Game, #1)",eng,3.81,26657,28206,1140,798,2070,7229,9716,8393
4950,Ruta Sepetys,2013.0,Out of the Easy,Out of the Easy,eng,4.05,25913,28925,4388,464,985,5290,11982,10204
4965,S.E. Hinton,1971.0,"That Was Then, This Is Now","That Was Then, This Is Now",en-US,3.89,22946,24028,1384,311,1327,6324,8776,7290
4977,Ann Brashares,2011.0,Sisterhood Everlasting,"Sisterhood Everlasting (Sisterhood, #5)",eng,3.9,25849,29366,3796,555,1930,6759,10838,9284
4985,"Patricia C. Wrede, Peter de Sève",1985.0,Unknown,"Talking to Dragons (Enchanted Forest Chronicles, #4)",en-US,4.19,27948,29038,546,272,915,5074,9550,13227
4987,"Neil Gaiman, Chris Riddell",2014.0,The Sleeper and the Spindle,The Sleeper and the Spindle,eng,3.9,20889,24708,3642,861,1340,5238,9259,8010
5016,Neal Shusterman,2006.0,Everlost,"Everlost (Skinjacker, #1)",eng,3.94,24506,25778,2431,587,1528,5731,8966,8966
5018,"John Grisham, Richard Thomas",2010.0,"Theodore Boone, Kid Lawyer","Theodore Boone: Kid Lawyer (Theodore Boone, #1)",eng,3.72,19284,23368,2965,609,1937,6872,7939,6011
5020,Richard Peck,2000.0,A Year Down Yonder,"A Year Down Yonder (A Long Way from Chicago, #2)",eng,4.1,23310,24350,1635,454,1004,4422,8278,10192
5022,Carlos Ruiz Zafón,1999.0,Marina,Marina,spa,3.99,18260,24929,1976,304,1299,5383,9274,8669
5025,Colleen Houck,2011.0,Tiger's Voyage,"Tiger's Voyage (The Tiger Saga, #3)",eng,4.35,24495,26949,2140,398,938,3294,6616,15703
5029,Louise Rennison,2001.0,Knocked out by my nunga-nungas,"Knocked Out by My Nunga-Nungas (Confessions of Georgia Nicolson, #3)",en-US,3.97,24077,26587,590,400,1362,6431,8864,9530
5032,Libba Bray,2009.0,Going Bovine,Going Bovine,eng,3.65,26259,27233,3602,1693,2996,6374,8229,7941
5034,Carrie Ryan,2010.0,The Dead-Tossed Waves ,"The Dead-Tossed Waves (The Forest of Hands and Teeth, #2)",en-US,3.91,26347,28001,2640,669,1921,6150,9683,9578
5036,Clare Vanderpool,2010.0,Moon Over Manifest,Moon Over Manifest,eng,4.02,23298,24791,4041,567,1125,4570,9591,8938
5038,"Jessica Anthony, Rodrigo Corral",2012.0,Unknown,Chopsticks,eng,3.72,18375,18377,1508,1062,1779,4481,4964,6091
5040,James Dashner,2013.0,The Eye of Minds,"The Eye of Minds (The Mortality Doctrine, #1)",eng,3.85,22637,26536,3517,732,2073,6145,9021,8565
5045,"Isabel Allende, Margaret Sayers Peden",2002.0,La ciudad de las bestias,"City of the Beasts (Eagle and Jaguar, #1)",eng,3.69,15497,22122,1155,635,2134,6280,7515,5558
5048,Meg Cabot,2003.0,Haunted,"Haunted (The Mediator, #5)",eng,4.15,29460,31368,681,195,998,5959,10981,13235
5049,Anne McCaffrey,1979.0,"Dragondrums (Pern: Harper Hall, #3)","Dragondrums (Harper Hall, #3)",eng,4.04,25473,27874,429,109,1035,6595,9959,10176
5078,Lauren Conrad,2009.0,L.A. Candy,"L.A. Candy (L.A. Candy, #1)",en-US,3.36,21910,23402,2076,1192,3587,8352,6128,4143
5079,Kiera Cass,2009.0,The Siren,The Siren,eng,3.78,21740,32274,4550,1015,2807,8396,10194,9862
5085,Patrick Ness,2015.0,The Rest of Us Just Live Here,The Rest of Us Just Live Here,eng,3.76,23412,29416,5689,560,2098,8153,11561,7044
5105,Jennifer E. Smith,2014.0,The Geography of You and Me,The Geography of You and Me,eng,3.68,22368,25739,3043,718,2186,7881,8737,6217
5106,L.A. Weatherly,2010.0,Angel ,"Angel (Angel, #1)",eng,3.89,22262,29204,2217,906,2230,6529,9184,10355
5107,Brandon Mull,2012.0,"Seeds of Rebellion (Beyonders, #2)","Seeds of Rebellion (Beyonders, #2)",eng,4.25,20291,21071,1183,286,542,2943,7085,10215
5118,Marissa Meyer,2016.0,Stars Above,"Stars Above (The Lunar Chronicles, #4.5)",eng,4.27,29333,32063,5123,93,541,4650,12077,14702
5136,D.J. MacHale,2005.0,The Rivers of Zadaa,"The Rivers of Zadaa (Pendragon, #6)",eng,4.19,20264,20945,317,200,652,3562,7165,9366
5148,Courtney Allison Moulton,2011.0,Angelfire,"Angelfire (Angelfire, #1)",en-US,3.93,27704,28225,1977,1099,1997,5723,8294,11112
5159,Darren Shan,2002.0,"The Vampire Prince (Cirque Du Freak, #6)","The Vampire Prince (Cirque Du Freak, #6)",,4.23,20877,22989,546,140,695,3785,7526,10843
5169,Ellen Hopkins,2011.0,Unknown,"Perfect (Impulse, #2)",en-US,4.35,21089,21716,1443,207,566,2740,6156,12047
5184,"Stephanie Perkins, Holly Black, Ally Carter, Matt de la Pena, Gayle Forman, Jenny Han, David Levithan, Kelly Link, Myra McEntire, Rainbow Rowell, Laini Taylor, Kiersten White",2014.0,My True Love Gave to Me: Twelve Holiday Stories,My True Love Gave to Me: Twelve Holiday Stories,eng,3.73,22480,26790,5521,564,1459,8074,11293,5400
5193,Melissa de la Cruz,2011.0,Lost In Time,"Lost in Time (Blue Bloods, #6)",eng,4.05,23154,24147,874,446,1312,4980,7271,10138
5194,Meg Cabot,2001.0,Ninth Key,"Ninth Key (The Mediator, #2)",eng,4.07,29922,32154,862,130,1117,7226,11740,11941
5199,Jacqueline Kelly,2009.0,The Evolution of Calpurnia Tate,"The Evolution of Calpurnia Tate (Calpurnia Tate, #1)",en-US,3.97,22291,24382,4019,589,1194,4768,9552,8279
5200,Katie Alender,2009.0,Bad Girls Don't Die,"Bad Girls Don't Die (Bad Girls Don't Die, #1)",eng,4.07,18862,22673,2389,436,1243,4301,7121,9572
5221,Shannon Hale,2006.0,River Secrets,"River Secrets (The Books of Bayern, #3)",,4.03,27399,28983,2249,283,949,6330,11402,10019
5224,Aprilynne Pike,2011.0,Illusions,"Illusions (Wings, #3)",en-US,4.12,26291,27722,1603,365,1221,5155,9034,11947
5259,Marissa Meyer,2016.0,Heartless,Heartless,eng,4.06,33348,37000,8605,607,1824,6554,13618,14397
5260,Paul Zindel,1968.0,The Pigman,"The Pigman (The Pigman, #1)",eng,3.58,21278,22807,1156,867,2438,7087,7474,4941
5262,Meg Cabot,2011.0,Abandon,"Abandon (Abandon, #1)",eng,3.71,30934,33159,3639,1355,3226,8814,10202,9562
5267,Robert Muchamore,2004.0,"The Recruit (Cherub, #1)","The Recruit (Cherub, #1)",eng,4.22,19679,22294,1626,278,748,3258,7476,10534
5271,Amanda Hocking,2010.0,My Blood Approves,"My Blood Approves (My Blood Approves, #1)",eng,3.83,21707,26660,1704,1082,2098,6102,8365,9013
5278,Simone Elkeles,2010.0,Return to Paradise,"Return to Paradise (Leaving Paradise, #2)",eng,4.05,29043,29892,1430,488,1649,5939,9604,12212
5279,Jasmine Warga,2015.0,My Heart and Other Black Holes,My Heart and Other Black Holes,eng,4.02,22311,27878,4279,361,1319,5586,10822,9790
5281,Heather Brewer,2008.0,"Ninth Grade Slays (The Chronicles of Vladimir Tod, #2)","Ninth Grade Slays (The Chronicles of Vladimir Tod, #2)",en-US,4.14,20198,22539,1042,335,1014,4172,6613,10405
5308,Joelle Charbonneau,2014.0,Independent Study,"Independent Study (The Testing, #2)",eng,3.97,20593,23831,2060,198,1101,5398,9655,7479
5320,A.S. King,2010.0,Please Ignore Vera Dietz,Please Ignore Vera Dietz,eng,3.91,21728,23333,3056,527,1354,5128,9073,7251
5321,"Joseph Delaney, Patrick  Arrasmith",2005.0,The Spook's Curse,"Curse of the Bane (The Last Apprentice / Wardstone Chronicles, #2)",,4.1,18513,21917,942,146,670,4351,8401,8349
5322,L.J. Smith,1991.0,The Struggle,"The Struggle (The Vampire Diaries, #2)",eng,3.5,23840,29037,1058,1337,4057,9093,7745,6805
5328,Jennifer A. Nielsen,2013.0,The Runaway King,"The Runaway King (The Ascendance Trilogy, #2)",eng,4.23,24032,25793,2859,201,680,3764,9571,11577
5338,Susan Beth Pfeffer,2010.0,This World We Live In,"This World We Live In (Last Survivors, #3)",en-US,3.81,23711,25456,2390,480,2002,7003,8413,7558
5342,"James Patterson, Ned Rust",2010.0,The Gift,"The Gift (Witch & Wizard, #2)",,3.78,17070,23816,1413,661,2094,6195,7676,7190
5345,Holly Black,2010.0,White Cat,"White Cat (Curse Workers, #1)",eng,3.81,29444,32957,3960,929,2241,8031,12771,8985
5350,Lauren Oliver,2015.0,Vanishing Girls,Vanishing Girls,en-CA,3.59,19508,21289,3439,564,2228,6779,7484,4234
5352,"Angie Sage, Mark Zug",2011.0,Darke,"Darke (Septimus Heap, #6)",eng,4.23,21322,22337,701,228,641,3430,7529,10509
5362,Susane Colasanti,2009.0,Waiting For You,Waiting For You,eng,3.84,20236,20656,798,532,1570,5478,6263,6813
5372,Meg Cabot,2001.0,Reunion,"Reunion (The Mediator, #3)",eng,4.09,28944,30937,664,167,996,6742,11083,11949
5383,Meg Cabot,2001.0,Darkest Hour,"Darkest Hour (The Mediator, #4)",eng,4.16,28104,29910,685,140,791,5686,10675,12618
5390,D.J. MacHale,2009.0,The Soldiers of Halla,"The Soldiers of Halla (Pendragon, #10)",en-US,4.27,19502,19934,522,343,734,2903,5214,10740
5391,E. Lockhart,2005.0,"The Boyfriend List: 15 Guys, 11 Shrink Appointments, 4 Ceramic Frogs and Me, Ruby Oliver (Ruby Oliver, #1)","The Boyfriend List: 15 Guys, 11 Shrink Appointments, 4 Ceramic Frogs and Me, Ruby Oliver (Ruby Oliver, #1)",en-US,3.49,22687,24018,1724,1180,2926,7723,7355,4834
5393,Veronica Roth,2014.0,Four: The Initiate,"The Initiate (Divergent, #0.2)",eng,4.2,15505,20659,618,219,660,3651,6351,9778
5402,Meg Cabot,2003.0,Princess in Pink,"Princess in Pink (The Princess Diaries, #5)",eng,3.69,27057,29540,639,444,2504,10120,9222,7250
5403,Ellen Schreiber,2008.0,"The Coffin Club (Vampire Kisses, #5)","The Coffin Club (Vampire Kisses, #5)",eng,4.06,22257,23288,420,535,1556,4731,5573,10893
5406,Catherine Gilbert Murdock,2006.0,Dairy Queen,"Dairy Queen (Dairy Queen, #1)",eng,3.73,23306,24821,2448,1003,2010,6345,8742,6721
5432,Malinda Lo,2009.0,Ash,Ash,en-US,3.62,14513,23952,2762,1199,2553,6553,7467,6180
5434,Megan McCafferty,2003.0,"Second Helpings (Jessica Darling, #2)","Second Helpings (Jessica Darling, #2)",eng,4.08,23180,23834,831,290,960,4680,8457,9447
5436,Carolyn Mackler,2003.0,"The Earth, My Butt, and Other Big Round Things","The Earth, My Butt, and Other Big Round Things",eng,3.77,21129,22209,1459,474,1775,6478,7195,6287
5440,Andrew Clements,2002.0,Things Not Seen,"Things Not Seen (Things, #1)",en-GB,3.88,21478,22288,1699,367,1333,5736,7987,6865
5444,Eoin Colfer,2004.0,The Supernaturalist,The Supernaturalist,en-US,3.85,23010,24352,1021,277,1595,6618,8871,6991
5452,Gordon Korman,2000.0,Schooled,Schooled,en-US,3.82,20411,21681,2441,588,1562,5602,7435,6494
5455,Gary Paulsen,1996.0,Brian's Winter,"Brian's Winter (Brian's Saga, #3)",en-US,3.98,16861,19542,1190,281,880,4518,7115,6748
5458,Louisa May Alcott,1886.0,"Jo's Boys, and How They Turned Out: A Sequel to ""Little Men""","Jo's Boys (Little Women, #3)",eng,3.8,23877,26465,544,306,1683,8009,9340,7127
5463,Susan Cooper,1974.0,Greenwitch,"Greenwitch (The Dark Is Rising, #3)",eng,4.0,21364,23531,632,201,933,5676,8641,8080
5465,Elizabeth Chandler,1995.0,Unknown,"Kissed by an Angel/The Power of Love/Soulmates (Kissed by an Angel, #1-3)",eng,4.08,21813,24037,1660,639,1429,4430,6474,11065
5469,Clive Barker,2002.0,Abarat,"Abarat (Abarat, #1)",en-US,4.08,20460,22343,1184,385,1045,4059,7777,9077
5473,Claudia Gray,2011.0,Afterlife,"Afterlife (Evernight, #4)",en-US,3.8,23780,24924,1174,848,2320,6273,7039,8444
5474,Nick Hornby,2007.0,Slam,Slam,en-US,3.27,17393,20196,1993,728,3105,8452,5906,2005
5475,Robin LaFevers,2013.0,"Dark Triumph (His Fair Assassin, #2)","Dark Triumph (His Fair Assassin, #2)",eng,4.15,28133,30080,3006,377,945,4836,11653,12269
5476,Kwame Alexander,2014.0,The Crossover,The Crossover,eng,4.22,21249,22935,4063,701,755,2807,7316,11356
5489,Aimee Carter,2012.0,Goddess Interrupted,"Goddess Interrupted (Goddess Test, #2)",eng,4.02,26286,27356,2107,571,1647,5492,8643,11003
5497,Darren Shan,2002.0,"Hunters of the Dusk (Cirque Du Freak, #7)","Hunters of the Dusk (Cirque Du Freak, #7)",,4.17,19326,21033,433,120,752,3868,6946,9347
5500,Katherine Paterson,1980.0,Jacob Have I Loved,Jacob Have I Loved,eng,3.64,24920,26710,1641,1066,2636,7650,8766,6592
5504,D.J. MacHale,2004.0,Black Water,"Black Water (Pendragon, #5)",eng,4.16,19634,20300,388,181,636,3640,7120,8723
5526,Carl Hiaasen,2005.0,Flush,Flush,en-US,3.86,20076,21766,2067,306,1218,5764,8377,6101
5532,Marieke Nijkamp,2016.0,This Is Where It Ends,This Is Where It Ends,eng,3.63,23764,27137,4929,1281,3106,7170,8414,7166
5535,Rebecca Stead,2012.0,Liar & Spy,Liar & Spy,eng,3.81,18990,20582,2256,577,1306,5211,7835,5653
5539,Meg Cabot,2009.0,Being Nikki,"Being Nikki (Airhead, #2)",eng,3.87,25531,26565,1017,421,1854,6931,9011,8348
5541,Margaret Peterson Haddix,2001.0,"Among the Impostors (Shadow Children, #2)","Among the Impostors (Shadow Children, #2)",en-US,4.05,21629,23909,1194,164,764,5311,9075,8595
5542,Christopher Pike,2010.0,The Eternal Dawn,"Thirst No. 3: The Eternal Dawn (Thirst, #3)",en-US,4.14,17343,17534,395,549,1052,2875,4005,9053
5544,Kristen Simmons,2012.0,Article 5,"Article 5 (Article 5, #1)",en-US,3.78,23732,24996,2552,1007,2127,6014,8111,7737
5552,Jordan Sonnenblick,2004.0,"Drums, Girls & Dangerous Pie","Drums, Girls & Dangerous Pie (Drums, Girls & Dangerous Pie, #1)",eng,4.25,18551,20877,2616,300,617,2866,6885,10209
5565,Darren Shan,2002.0,"Allies of the Night (Cirque Du Freak, Book 8)","Allies of the Night (Cirque du Freak, #8)",,4.19,18649,20295,404,128,686,3587,6605,9289
5567,L.M. Montgomery,1919.0,Rainbow Valley,"Rainbow Valley (Anne of Green Gables, #7)",eng,4.0,27353,29297,752,212,1369,6925,10355,10436
5574,Jennifer Donnelly,2010.0,Revolution,Revolution,eng,4.02,20607,24843,3765,592,1363,4626,8627,9635
5582,Garth Nix,2004.0,Drowned Wednesday,"Drowned Wednesday (The Keys to the Kingdom, #3)",en-US,3.85,21267,22243,385,217,1151,6456,8307,6112
5585,"James Patterson, Maxine Paetro",2012.0,Confessions of a murder suspect,"Confessions of a Murder Suspect (Confessions, #1)",eng,3.89,19223,22686,2335,538,1552,5304,7683,7609
5589,Jerry Spinelli,2003.0,Milkweed,Milkweed,eng,4.0,19461,20592,1966,329,1032,4327,7542,7362
5597,Amy Ewing,2014.0,The Jewel,"The Jewel (The Lone City, #1)",eng,3.86,21247,25469,3473,713,1827,5852,8886,8191
5632,Diana Wynne Jones,1990.0,Castle in the Air,"Castle in the Air (Howl's Moving Castle, #2)",,3.93,22964,26770,1599,175,1119,6799,11091,7586
5633,Jude Watson,2011.0,A King's Ransom,"A King's Ransom (The 39 Clues: Cahills vs. Vespers, #2)",eng,4.14,18168,18469,355,332,739,3602,5110,8686
5636,Elizabeth Scott,2008.0,Living Dead Girl,Living Dead Girl,en-US,3.83,22014,24327,3593,819,1845,5781,7976,7906
5645,Holly Black,2015.0,The Darkest Part of the Forest,The Darkest Part of the Forest,eng,3.91,22992,25498,4304,491,1487,5577,10166,7777
5652,"Scott Westerfeld, Keith Thompson",2011.0,Goliath,"Goliath (Leviathan, #3)",eng,4.25,23911,25391,2303,167,559,3594,9438,11633
5660,Beth Revis,2013.0,Shades of Earth,"Shades of Earth (Across the Universe, #3)",eng,4.11,24612,26839,3442,445,1146,4734,9221,11293
5661,Ursula K. Le Guin,1990.0,Tehanu,"Tehanu (Earthsea Cycle, #4)",eng,3.89,19503,23207,966,375,1435,5643,8668,7086
5662,Amy Tintera,2013.0,Reboot,"Reboot (Reboot, #1)",eng,3.92,23300,25819,3128,502,1494,5622,10225,7976
5697,Heather Dixon,2011.0,Entwined,Entwined,en-US,3.87,28950,30536,4592,776,2219,7258,10297,9986
5708,Ben Mikaelsen,1997.0,Touching Spirit Bear,"Touching Spirit Bear (Spirit Bear, #1)",eng,3.85,17706,18850,2716,725,1400,4201,6249,6275
5712,Kiera Cass,2014.0,The Selection Stories: The Prince & The Guard,"The Selection Stories: The Prince & The Guard (The Selection, #0.5, 2.5)",eng,4.03,23695,25596,1797,319,1346,5813,7983,10135
5722,"Joseph Delaney, Patrick  Arrasmith",2007.0,Night of the Soul Stealer,"Night of the Soul Stealer (The Last Apprentice / Wardstone Chronicles, #3)",,4.12,18279,21196,605,187,620,4209,7654,8526
5724,Jennifer Echols,2010.0,Endless Summer,"Endless Summer (The Boys Next Door, #1-2)",eng,4.02,18438,18642,648,417,1223,3860,5275,7867
5729,Kelly Creagh,2010.0,Nevermore,"Nevermore (Nevermore, #1)",en-US,3.87,24570,25502,2473,1247,2177,5169,6910,9999
5732,"Jonathan Stroud, Simon  Jones",2010.0,The Ring of Solomon,"The Ring of Solomon (Bartimaeus, #0.5)",eng,4.19,18809,21718,1208,329,568,3380,7850,9591
5755,Holly Black,2002.0,Tithe: A Modern Faerie Tale ,Valiant (Modern Faerie Tales #2),eng,3.92,26108,27834,1276,527,1873,6713,9040,9681
5793,Mary E. Pearson,2015.0,The Heart of Betrayal,"The Heart of Betrayal (The Remnant Chronicles, #2)",eng,4.32,24104,26504,3507,143,503,3013,9837,13008
5803,Ellen Schreiber,2007.0,"Dance with a Vampire (Vampire Kisses, #4)","Dance with a Vampire (Vampire Kisses, #4)",eng,4.01,22119,23240,472,532,1607,5172,5659,10270
5805,Tamora Pierce,1998.0,Tris's Book,"Tris's Book (Circle of Magic, #2)",eng,4.07,24511,25857,386,161,1005,5724,9059,9908
5810,Scott Westerfeld,2004.0,The Secret Hour,"The Secret Hour (Midnighters, #1)",eng,3.8,23933,26170,1951,477,1853,7194,9430,7216
5813,Brandon Mull,2007.0,The Candy Shop War,"The Candy Shop War (The Candy Shop War, #1)",,4.03,19619,20777,2185,292,941,4482,7137,7925
5815,Maggie Stiefvater,2008.0,"Lament: The Faerie Queen's Deception (Books of Faerie, #1) ","Lament: The Faerie Queen's Deception (Books of Faerie, #1)",eng,3.69,26116,28824,2658,885,2740,8144,9603,7452
5822,"Carlos Ruiz Zafón, Lucia Graves",1986.0,El príncipe de la niebla,"The Prince of Mist (Niebla, #1)",eng,3.66,14381,22022,2069,350,1862,7253,7971,4586
5827,"Laura Ingalls Wilder, Garth Williams",1953.0,The First Four Years,"The First Four Years  (Little House, #9)",eng,3.88,24180,28095,749,371,1783,7756,9222,8963
5842,Renee Ahdieh,2016.0,The Rose & the Dagger,"The Rose & the Dagger (The Wrath & the Dawn, #2)",eng,4.2,26503,29059,5261,212,904,4333,11110,12500
5855,Jenny Nimmo,2005.0,"Charlie Bone and the Castle of Mirrors (The Children of the Red King, # 4)","Charlie Bone and the Castle of Mirrors (The Children of the Red King, #4)",,3.89,20101,20593,295,329,1200,5476,6927,6661
5857,Andrea Cremer,2012.0,Bloodrose,Bloodrose (Nightshade #3; Nightshade World #6),eng,4.06,23874,24920,2208,803,1428,4421,7104,11164
5875,Rae Carson,2013.0,The Bitter Kingdom,"The Bitter Kingdom (Fire and Thorns, #3)",eng,4.23,24420,26657,2392,305,728,3720,9702,12202
5880,Megan Whalen Turner,2000.0,The Queen of Attolia,"The Queen of Attolia (The Queen's Thief, #2)",,4.23,23813,25299,2400,287,768,3519,9091,11634
5890,Jeanne DuPrau,2006.0,The Prophet of Yonwood,"The Prophet of Yonwood (Book of Ember, #3)",en-US,3.25,22237,23844,2106,1487,4480,8323,5642,3912
5900,Julie   Murphy,2015.0,Dumplin',"Dumplin' (Dumplin', #1)",eng,3.87,22176,23876,4521,440,1277,5897,9633,6629
5913,Wendy Mass,2005.0,A Mango-Shaped Space,A Mango-Shaped Space,eng,4.22,20661,21859,2341,199,677,3404,7449,10130
5939,Laurie Halse Anderson,2014.0,The Impossible Knife of Memory,The Impossible Knife of Memory,eng,3.93,20992,22227,3246,416,1200,4894,8786,6931
5943,"Julie Anne Peters, C.J. Bott",2009.0,"By The Time You Read This, I'll Be Dead","By the Time You Read This, I'll Be Dead",,3.89,18722,19562,1723,552,1532,4554,5877,7047
5946,D.J. MacHale,2005.0,The Quillan Games,"The Quillan Games (Pendragon, #7)",eng,4.19,18296,18876,329,170,627,3294,6225,8560
5959,Rita Williams-Garcia,2010.0,One Crazy Summer,"One Crazy Summer (Gaither Sisters, #1)",eng,3.95,18913,20219,2862,423,1039,4319,7762,6676
5967,"Blue Balliett, Brett Helquist",2004.0,Chasing Vermeer,"Chasing Vermeer (Chasing Vermeer, #1)",en-US,3.71,22167,23528,2032,772,2147,6419,7958,6232
5974,Kiera Cass,2014.0,The Queen,"The Queen (The Selection, #0.4)",eng,3.93,22362,24726,1858,513,1661,5989,7489,9074
5981,Sarah Rees Brennan,2012.0,Unspoken,"Unspoken (The Lynburn Legacy, #1)",eng,3.85,22927,24419,3363,779,1738,5487,8716,7699
5985,Kelley Armstrong,2012.0,The Calling,"The Calling (Darkness Rising, #2)",eng,4.1,25930,27424,1731,162,968,5531,9980,10783
5989,Jessica Day George,2009.0,Princess of the Midnight Ball,"Princess of the Midnight Ball (The Princesses of Westfalin Trilogy, #1)",eng,3.92,26804,28183,3319,362,1485,7086,10463,8787
5997,Jennifer Echols,2010.0,Forget You,Forget You,eng,3.79,24334,24795,1311,782,2202,6346,7631,7834
6009,Megan Whalen Turner,2006.0,The King of Attolia,"The King of Attolia (The Queen's Thief, #3)",eng,4.37,22724,24349,2029,237,537,2663,7505,13407
6010,"Ridley Pearson, David Frankland",2004.0,The Kingdom Keepers,"Disney after Dark (Kingdom Keepers, #1)",,3.91,18193,20906,2224,498,1479,4919,6585,7425
6014,V.C. Andrews,1982.0,My Sweet Audrina,"My Sweet Audrina (Audrina, #1)",,3.92,18549,19602,844,434,1356,4769,5906,7137
6031,Craig Silvey,2009.0,Jasper Jones,Jasper Jones,eng,4.06,12680,18235,2063,288,803,3054,7445,6645
6034,Nina LaCour,2009.0,Hold Still,Hold Still,en-US,3.99,16238,17546,1440,456,947,3584,5967,6592
6040,Jonathan Stroud,2013.0,The Screaming Staircase,"The Screaming Staircase (Lockwood & Co., #1)",eng,4.19,15446,19372,3067,375,522,2596,7368,8511
6051,Ally Carter,2013.0,United We Spy,"United We Spy (Gallagher Girls, #6)",eng,4.44,22902,24587,2173,129,379,2609,6918,14552
6053,Anthony Horowitz,2005.0,Raven's Gate,"Raven's Gate (The Gatekeepers, #1)",,3.9,18247,20257,1201,424,1300,4726,7192,6615
6056,Melissa de la Cruz,2010.0,Bloody Valentine,"Bloody Valentine (Blue Bloods, #5.5)",en-US,3.98,19903,20966,713,412,1392,4828,5926,8408
6086,Ellen Schreiber,2006.0,"Vampireville (Vampire Kisses, #3)","Vampireville (Vampire Kisses, #3)",en-GB,3.92,21676,22429,503,637,1796,5433,5380,9183
6122,Louise Rennison,2002.0,Dancing in my nuddy-pants!,"Dancing in My Nuddy-Pants (Confessions of Georgia Nicolson, #4)",eng,4.01,18451,20861,425,239,917,4872,7100,7733
6124,Julie Anne Peters,2004.0,Luna,Luna,en-US,3.86,17859,18820,1360,701,1289,4401,6016,6413
6133,D.J. MacHale,2003.0,The Reality Bug,"The Reality Bug (Pendragon, #4)",eng,4.15,19049,19539,428,147,673,3682,6707,8330
6164,Margaret Peterson Haddix,2002.0,Among the Betrayed,"Among the Betrayed (Shadow Children, #3)",en-US,4.06,19964,20905,872,132,723,4668,7526,7856
6175,Darren Shan,2002.0,"The Lake of Souls (Cirque Du Freak, #10)","The Lake of Souls (Cirque Du Freak, #10)",,4.19,16803,18281,405,188,796,3094,5525,8678
6182,V.C. Andrews,1985.0,Heaven,"Heaven (Casteel, #1)",eng,4.01,17289,18252,463,240,1013,4153,5713,7133
6183,Jenny Nimmo,2006.0,"Charlie Bone and the Hidden King (The Children of the Red King, # 5)","Charlie Bone and the Hidden King (The Children of the Red King, #5)",,3.98,18899,19344,302,282,970,4579,6532,6981
6201,Meg Cabot,2006.0,Princess in Training,"Princess in Training (The Princess Diaries, #6)",,3.7,23199,25362,584,375,2168,8440,8115,6264
6209,Elizabeth Eulberg,2010.0,The Lonely Hearts Club,"The Lonely Hearts Club (The Lonely Hearts Club, #1)",eng,3.83,18208,21410,1986,486,1678,5368,7293,6585
6214,Veronica Roth,2012.0,Unknown,"The Divergent Series 2-Book Collection (Divergent, #1-2)",eng,4.56,12490,14038,255,158,254,1059,2666,9901
6226,Andrew  Smith,2013.0,Winger,"Winger (Winger, #1)",eng,4.08,18596,19460,3851,748,1041,2875,6043,8753
6230,Melvin Burgess,1996.0,Junk,Smack,en-US,3.87,11971,15614,649,364,1147,3842,5076,5185
6233,Jenny Nimmo,2003.0,Charlie Bone and the Time Twister ,"Charlie Bone and the Time Twister (The Children of the Red King, #2)",,3.88,18374,19680,488,292,1090,5345,6894,6059
